{
  "format": "olistic.confiance.politique/2",
  "version": 1,
  "generation": 2,
  "racine": {
    "proprietaire": "revue-racine",
    "proprietaire_id": 339338245,
    "depot": "racine-revue",
    "depot_id": 1409404929,
    "workflow": ".github/workflows/revue.yml",
    "nom_workflow": "revue",
    "ref": "refs/heads/main"
  },
  "type_predicat": "urn:olistic:confiance:attestation-revue:2",
  "demandeurs": [
    {
      "login": "miguelfromba",
      "id": 241122414
    }
  ],
  "depots": [
    {
      "alias": "auto-test",
      "repository_id": 1409404929
    }
  ],
  "relecteurs": [
    {
      "famille": "openai-responses",
      "actif": true,
      "acceptable": false,
      "modeles": [
        "gpt-6.1-sol"
      ]
    }
  ],
  "fraicheur": {
    "coupure": "2026-10-08T00:00:00Z",
    "validite_s": 604800,
    "tolerance_instant_s": 1800,
    "derive_horloge_s": 60
  },
  "limites": {
    "corps_demande_octets": 1024,
    "diff_octets": 500000
  }
}
